<?xml version="1.0" encoding="UTF-8"?>
<fiche xmlns:xsi="http://www.w3.org/2001/XMLSchema-instance"
    xsi:noNamespaceSchemaLocation="plante_TextViz.xsd">
    <description>
    <taxon type="genre">Osteospermum</taxon>
        <parent type = "famille">Asteraceae</parent>
        <contenu>
            <paragraphe>
                <titre>Dimorphothéca Annuelle</titre>
                <alinea>

                </alinea>
            </paragraphe>
        </contenu>

    <photos_plante>
        <photo_plante>
            <titre_photo>
                Dimorphothéca
            </titre_photo> 
            <fichier_photo_plante>
                p286_Dimorphotheca.jpg
            </fichier_photo_plante>
        </photo_plante>
    </photos_plante>
 
    <classeVilmorin type= "fleur"/>
    </description>
</fiche>
