<?xml version="1.0" encoding="UTF-8"?>
<fiche xmlns:xsi="http://www.w3.org/2001/XMLSchema-instance" xsi:noNamespaceSchemaLocation="plante_TextViz.xsd">
  <description>
    <taxon type="espece">Cistus albidus</taxon>
    <parent type="genre">Cistus</parent>
    <contenu>
      <paragraphe>
        <titre>CISTE ALBIDUS</titre>
        <alinea> Hauteur 1,50 à 2 m. Feuilles duveteuses, argentées. Fleurs rose pâle.</alinea>
      </paragraphe>
    </contenu>
    <maladies />
    <photos_plante />
    <classeVilmorin type="arbuste" />
  </description>
</fiche>

