<?xml version="1.0" encoding="UTF-8"?>
<fiche xmlns:xsi="http://www.w3.org/2001/XMLSchema-instance" xsi:noNamespaceSchemaLocation="plante_TextViz.xsd">
  <description>
    <taxon type="genre">Physostegia</taxon>
    <parent type="famille">Labiac√©es</parent>
    <contenu>
      <paragraphe>
        <titre>PHYSOSTEGIA VIVACE</titre>
        <alinea />
      </paragraphe>
    </contenu>
    <classeVilmorin type="fleur" />
  </description>
</fiche>

