<?xml version="1.0" encoding="UTF-8"?>
<fiche xmlns:xsi="http://www.w3.org/2001/XMLSchema-instance"
    xsi:noNamespaceSchemaLocation="plante_TextViz.xsd">
    <description>
        <taxon type="genre">Polypodium</taxon>
        <parent type = "famille">Polypodiaceae</parent>
        <contenu>
            <paragraphe>
                <titre>Polypodium</titre>
                <alinea>

                </alinea>
            </paragraphe>
        </contenu>
    <classeVilmorin type= "fleur"/>
    </description>
</fiche>
