<?xml version="1.0" encoding="UTF-8"?>
<fiche xmlns:xsi="http://www.w3.org/2001/XMLSchema-instance" xsi:noNamespaceSchemaLocation="plante_TextViz.xsd">
  <description>
    <taxon type="genre">Gaura Lindheimeri</taxon>
    <parent type="famille">Oenotheracées</parent>
    <contenu>
      <paragraphe>
        <titre>GAURA DE LINDHEIMER VIVACE</titre>
        <alinea />
      </paragraphe>
    </contenu>
    <classeVilmorin type="fleur" />
  </description>
</fiche>

