<?xml version="1.0" encoding="UTF-8"?>
<fiche xmlns:xsi="http://www.w3.org/2001/XMLSchema-instance" xsi:noNamespaceSchemaLocation="plante_TextViz.xsd">
  <description>
    <taxon type="genre">Oléaria</taxon>
    <parent type="famille">Composées</parent>
    <contenu>
      <paragraphe>
        <titre>OLEARIA PERSISTANT</titre>
        <alinea>• Fleurit en mai-juin • Peu rustique</alinea>
      </paragraphe>
    </contenu>
    <classeVilmorin type="arbuste" />
  </description>
</fiche>

